{
  "$schema": "https://json-schema.org/draft/2020-12/schema",
  "$id": "https://skill-sys.dev/schema/skillpack.schema.json",
  "title": "Skill-Sys skillpack manifest",
  "type": "object",
  "additionalProperties": false,
  "patternProperties": {
    "^x-[a-z0-9._-]+$": {}
  },
  "required": ["name", "version", "visibility", "engine", "skills", "profiles", "providers", "privacy", "security"],
  "properties": {
    "$schema": { "type": "string" },
    "name": { "type": "string", "minLength": 1, "pattern": "^(?:@[a-z0-9][a-z0-9._-]*/)?[a-z0-9][a-z0-9._-]*$" },
    "version": { "type": "string", "pattern": "^[0-9]+\\.[0-9]+\\.[0-9]+(?:[-+][0-9A-Za-z.-]+)?$" },
    "visibility": { "type": "string", "enum": ["public", "private"] },
    "engine": {
      "type": "object",
      "required": ["skillSys"],
      "additionalProperties": false,
      "patternProperties": { "^x-[a-z0-9._-]+$": {} },
      "properties": { "skillSys": { "type": "string", "minLength": 1 } }
    },
    "skills": { "type": "array", "minItems": 1, "items": { "type": "string", "pattern": "^[a-z0-9][a-z0-9._-]*$" }, "uniqueItems": true },
    "profiles": { "type": "array", "items": { "type": "string", "pattern": "^[a-z0-9][a-z0-9._-]*$" }, "uniqueItems": true },
    "providers": { "type": "array", "items": { "type": "string", "pattern": "^[a-z0-9][a-z0-9._-]*$" }, "uniqueItems": true },
    "privacy": {
      "type": "object",
      "required": ["containsPersonalData", "containsLocalPaths", "containsCompanyData"],
      "additionalProperties": false,
      "patternProperties": { "^x-[a-z0-9._-]+$": {} },
      "properties": {
        "containsPersonalData": { "type": "boolean" },
        "containsLocalPaths": { "type": "boolean" },
        "containsCompanyData": { "type": "boolean" }
      }
    },
    "security": {
      "type": "object",
      "required": ["requiresRiskProfiles", "requiresTriggerEvalsForRiskySkills"],
      "additionalProperties": false,
      "patternProperties": { "^x-[a-z0-9._-]+$": {} },
      "properties": {
        "requiresRiskProfiles": { "type": "boolean" },
        "requiresTriggerEvalsForRiskySkills": { "type": "boolean" }
      }
    }
  }
}
